{
  "id": "aki-staging-rrt",
  "section": "Reference Library",
  "category": "Critical Care",
  "title": "AKI Staging & Renal Replacement Therapy",
  "settingEmphasis": [
    "icu"
  ],
  "aliases": [
    "KDIGO AKI staging",
    "acute kidney injury stages",
    "RRT indications",
    "AEIOU dialysis",
    "CRRT settings",
    "CVVHDF dose",
    "regional citrate anticoagulation"
  ],
  "tags": [
    "AKI",
    "acute kidney injury",
    "KDIGO",
    "dialysis",
    "RRT",
    "CRRT",
    "nephrotoxins",
    "hyperkalemia",
    "uremia",
    "ICU"
  ],
  "keywords": [
    "creatinine 1.5x baseline",
    "urine output < 0.5 mL/kg/h",
    "AEIOU",
    "effluent 20-25 mL/kg/hr",
    "regional citrate",
    "avoid NSAIDs contrast aminoglycosides"
  ],
  "contentType": "reference",
  "content_version": 2,
  "last_reviewed": "2026-09-02",
  "next_review_due": "2027-03-02",
  "review_tier": 3,
  "sources": [
    "Critical Vector — ICU Pocket Guide: AKI Staging & RRT",
    "KDIGO Clinical Practice Guideline for Acute Kidney Injury (2012)"
  ],
  "changelog": [
    {
      "version": 2,
      "date": "2026-09-07",
      "change": "Added whyThisMatters + clinicalTakeaway (standard Reference Library template, DIRECTIONS_FORWARD §1)."
    },
    {
      "version": 1,
      "date": "2026-09-02",
      "change": "Initial entry — KDIGO staging, the nephrotoxin list, the AEIOU emergent-RRT indications, and default CRRT settings."
    }
  ],
  "summary": "Stage AKI on whichever is worse — creatinine or urine output. Stop nephrotoxins, optimise volume and perfusion, and dose-adjust drugs. Start RRT emergently for the AEIOU indications; timing of RRT for AKI without an emergent indication is not improved by starting early (STARRT-AKI, AKIKI).",
  "whyThisMatters": "AKI staging drives nothing if you only look at creatinine — urine output often stages higher and earlier — and the timing of non-emergent RRT has been settled: starting early does not help (STARRT-AKI), so the decision hinges on whether an emergent indication is present.",
  "clinicalTakeaway": "Stage on the worse of creatinine or urine output. Stop nephrotoxins, fix volume and perfusion, and renally dose-adjust every drug. Start RRT now for an AEIOU indication (refractory acidosis, electrolytes, intoxication, overload, uraemia); otherwise there is no benefit to starting before one appears.",
  "body": [
    {
      "type": "heading",
      "level": 2,
      "text": "KDIGO staging (use the worse of the two)"
    },
    {
      "type": "table",
      "columns": [
        "Stage",
        "Creatinine",
        "Urine output"
      ],
      "rows": [
        [
          "1",
          "↑ ≥ 0.3 mg/dL within 48 h, OR ↑ 1.5–1.9× baseline within 7 days",
          "< 0.5 mL/kg/h for 6–12 h"
        ],
        [
          "2",
          "↑ 2.0–2.9× baseline",
          "< 0.5 mL/kg/h for ≥ 12 h"
        ],
        [
          "3",
          "↑ ≥ 3× baseline, OR ≥ 4.0 mg/dL, OR RRT started, OR (< 18 y) eGFR < 35",
          "< 0.3 mL/kg/h for ≥ 24 h, OR anuria ≥ 12 h"
        ]
      ]
    },
    {
      "type": "callout",
      "tone": "warning",
      "text": "Avoid nephrotoxins: NSAIDs, iodinated contrast (see the contrast-associated-AKI module), aminoglycosides, vancomycin without AUC monitoring, and stop / renally dose ACE-I/ARB, metformin (contrast), and SGLT2 inhibitors during acute illness. Check drug doses against the current eGFR — and remember creatinine LAGS a falling GFR."
    },
    {
      "type": "heading",
      "level": 2,
      "text": "Emergent RRT indications — AEIOU"
    },
    {
      "type": "table",
      "columns": [
        "",
        "Trigger"
      ],
      "rows": [
        [
          "A — Acidosis",
          "Severe metabolic acidosis (pH < 7.1) refractory to bicarbonate / respiratory compensation"
        ],
        [
          "E — Electrolytes",
          "K⁺ > 6.5 mEq/L refractory to medical therapy (or rapidly rising with ECG changes)"
        ],
        [
          "I — Ingestion / intoxication",
          "A dialysable toxin: methanol, ethylene glycol, lithium, salicylate, valproic acid, metformin (with lactic acidosis)"
        ],
        [
          "O — Overload",
          "Fluid overload (≈ ≥ 10% body weight) refractory to diuretics, causing hypoxaemia"
        ],
        [
          "U — Uremia",
          "BUN > 100 with uraemic symptoms — pericarditis / rub, encephalopathy / asterixis, uraemic bleeding"
        ]
      ]
    },
    {
      "type": "text",
      "text": "Without an AEIOU emergency, a watchful-waiting strategy (start RRT when an indication develops) is non-inferior to early elective initiation and avoids RRT altogether in a substantial fraction of patients (AKIKI, IDEAL-ICU, STARRT-AKI)."
    },
    {
      "type": "heading",
      "level": 2,
      "text": "CRRT defaults"
    },
    {
      "type": "list",
      "items": [
        "Mode: CVVHDF (convection + diffusion) is the common default; CVVH or CVVHD are equivalent for solute clearance.",
        "Dose: effluent 20–25 mL/kg/h prescribed (prescribe ~25–30 to allow for downtime and achieve the delivered target). Higher-intensity dosing has no outcome benefit and worsens micronutrient / antibiotic clearance.",
        "Anticoagulation: regional citrate is first-line (longer filter life, less bleeding) — contraindicated / cautious in severe liver failure or shock with lactic acidosis (citrate accumulation → rising total:ionised calcium ratio). Systemic UFH is the alternative; no anticoagulation if actively bleeding.",
        "Protein: 2.0–2.5 g/kg/day on CRRT (amino acid losses across the filter). Watch for hypophosphataemia and hypokalaemia — often need to add phosphate / potassium to the replacement fluid.",
        "Re-dose antibiotics for CRRT clearance (e.g. higher β-lactam doses, vancomycin by levels) — under-dosing is common."
      ]
    }
  ],
  "related": [
    "contrast-associated-aki",
    "hyperkalemia-management",
    "abg-interpretation",
    "iv-fluids",
    "meld-na",
    "renal-dose-adjustment-critical-illness-antibiotics"
  ],
  "buildNote": "Tier 3. STARRT-AKI / AKIKI timing evidence added from standard practice. A contrast-nephropathy pathway already exists as its own module."
}
