{
  "id": "padis-bundle",
  "section": "Reference Library",
  "category": "Critical Care",
  "title": "PADIS Bundle & RASS",
  "settingEmphasis": [
    "icu"
  ],
  "aliases": [
    "pain agitation delirium immobility sleep",
    "RASS scale",
    "CAM-ICU",
    "CPOT",
    "ICU sedation target",
    "analgesia-first sedation",
    "dexmedetomidine over propofol",
    "SAT SBT"
  ],
  "tags": [
    "PADIS",
    "sedation",
    "analgesia",
    "delirium",
    "RASS",
    "CAM-ICU",
    "ABCDEF",
    "ICU",
    "immobility",
    "sleep"
  ],
  "keywords": [
    "RASS -1 to 0",
    "analgesia first",
    "daily SAT",
    "CAM-ICU negative",
    "dexmedetomidine light sedation MV",
    "anxiety 6th domain",
    "avoid benzodiazepines"
  ],
  "contentType": "reference",
  "content_version": 2,
  "last_reviewed": "2026-09-02",
  "next_review_due": "2026-12-02",
  "review_tier": 3,
  "sources": [
    "Critical Vector — ICU Pocket Guide: PADIS Bundle (SCCM/PADIS 2025)",
    "SCCM PADIS guideline (2018) + 2025 update; ICU Liberation / ABCDEF bundle"
  ],
  "changelog": [
    {
      "version": 2,
      "date": "2026-09-07",
      "change": "Added whyThisMatters + clinicalTakeaway (standard Reference Library template, DIRECTIONS_FORWARD §1)."
    },
    {
      "version": 1,
      "date": "2026-09-02",
      "change": "Initial entry — the PADIS domains + tools + targets, the RASS scale, and the ICU sedative/analgesic quick-reference. 2025 update: dexmedetomidine over propofol for light sedation in ventilated adults; Anxiety added as a 6th domain."
    }
  ],
  "summary": "Analgesia FIRST — treat pain before titrating sedation. Target RASS −1 to 0 for most ventilated patients. Assess each domain with a validated tool every shift. Avoid benzodiazepines (delirium). PADIS 2025: dexmedetomidine is suggested over propofol for light sedation in ventilated adults, and anxiety is a new sixth domain (non-pharmacologic strategies first).",
  "whyThisMatters": "ICU sedation goes wrong when it is titrated before pain is treated, aimed too deep, or run on benzodiazepines — each drives delirium, ventilator days, and long-term cognitive harm. PADIS is a bundle precisely because the domains interact.",
  "clinicalTakeaway": "Analgesia first — treat pain before touching sedation. Target RASS −1 to 0 for most ventilated patients, assess each PADIS domain with a validated tool every shift, and avoid benzodiazepines; PADIS 2025 suggests dexmedetomidine over propofol for light sedation.",
  "body": [
    {
      "type": "heading",
      "level": 2,
      "text": "Domains, tools, targets"
    },
    {
      "type": "table",
      "columns": [
        "Domain",
        "Tool",
        "Target"
      ],
      "rows": [
        [
          "Pain",
          "NRS (verbal) / CPOT or BPS (non-verbal)",
          "NRS < 4 / CPOT < 3"
        ],
        [
          "Agitation / sedation",
          "RASS or SAS",
          "RASS −1 to 0 (deeper only for a specific indication)"
        ],
        [
          "Delirium",
          "CAM-ICU (ventilated) / ICDSC",
          "CAM-ICU negative"
        ],
        [
          "Immobility",
          "IMS mobility score",
          "Progressive daily mobility (out of bed as early as safe)"
        ],
        [
          "Sleep",
          "Richards-Campbell Sleep Questionnaire",
          "Minimize nocturnal interruptions; cluster care; day/night light cues"
        ],
        [
          "Anxiety (new 2025)",
          "Anxiety VAS, STAI-S",
          "Non-pharmacologic first — music, VR, family presence, reassurance"
        ]
      ]
    },
    {
      "type": "text",
      "text": "Wrap it in the ABCDEF bundle: Assess/treat pain · Both spontaneous awakening + breathing trials · Choice of light sedation (dexmedetomidine or propofol, not a benzo) · Delirium assess/prevent/manage · Early mobility · Family engagement. Bundle adherence is associated with lower 7-day mortality and less delirium."
    },
    {
      "type": "heading",
      "level": 2,
      "text": "RASS"
    },
    {
      "type": "table",
      "columns": [
        "Score",
        "Term",
        "Description"
      ],
      "rows": [
        [
          "+4",
          "Combative",
          "Violent, immediate danger to staff"
        ],
        [
          "+3",
          "Very agitated",
          "Pulls at or removes tubes / catheters; aggressive"
        ],
        [
          "+2",
          "Agitated",
          "Frequent non-purposeful movement; fights the ventilator"
        ],
        [
          "+1",
          "Restless",
          "Anxious, movements not aggressive"
        ],
        [
          "0",
          "Alert and calm",
          "TARGET for most patients"
        ],
        [
          "−1",
          "Drowsy",
          "Not fully alert; sustained (> 10 s) awakening to voice"
        ],
        [
          "−2",
          "Light sedation",
          "Briefly (< 10 s) awakens to voice"
        ],
        [
          "−3",
          "Moderate sedation",
          "Movement or eye-opening to voice, no eye contact"
        ],
        [
          "−4",
          "Deep sedation",
          "No response to voice; movement to physical stimulation"
        ],
        [
          "−5",
          "Unarousable",
          "No response to voice or physical stimulation"
        ]
      ]
    },
    {
      "type": "heading",
      "level": 2,
      "text": "ICU sedative & analgesic quick-reference"
    },
    {
      "type": "table",
      "columns": [
        "Drug",
        "Dose",
        "Class / key points"
      ],
      "rows": [
        [
          "Dexmedetomidine",
          "0.2–1.5 mcg/kg/hr (loading dose often skipped)",
          "α2-agonist — cooperative sedation, no respiratory depression; bradycardia / hypotension. PADIS 2025: preferred over propofol for light sedation in MV adults. Can't reliably sedate a genuinely agitated patient alone (SPICE III)"
        ],
        [
          "Propofol",
          "5–50 mcg/kg/min",
          "GABA — fast on/off, easy neuro checks. PRIS if > 4–5 mg/kg/hr for > 48 h — trend triglycerides q72h, watch for unexplained metabolic acidosis / new arrhythmia"
        ],
        [
          "Midazolam",
          "0.02–0.1 mg/kg/hr",
          "Benzodiazepine — AVOID for routine sedation (delirium, prolonged wake-up). Reserve for status epilepticus or severe alcohol withdrawal"
        ],
        [
          "Ketamine (adjunct)",
          "0.1–0.5 mg/kg/hr",
          "Opioid-sparing, bronchodilator; increases secretions; historically ICP concern is not supported in sedated/ventilated patients"
        ],
        [
          "Fentanyl",
          "25–200 mcg/hr",
          "The default ICU opioid; hepatic metabolism, accumulates with prolonged infusion (context-sensitive half-time)"
        ],
        [
          "Hydromorphone",
          "0.5–3 mg/hr",
          "~5× the potency of morphine; safer than morphine in renal failure (no active metabolite accumulation)"
        ]
      ]
    }
  ],
  "related": [
    "sedation-analgesia-agents",
    "icu-workflow",
    "ventilator-management",
    "status-epilepticus-adult"
  ],
  "buildNote": "Tier 3. Complements icu-workflow (admission checklist) and sedation-analgesia-agents (agent pharmacology). A CAM-ICU / ICDSC scoring tool is a calculator candidate."
}
