{
  "id": "rsi-seven-ps",
  "section": "Reference Library",
  "category": "Resuscitation & Airway",
  "title": "RSI — the 7 P's, Drugs & Post-Intubation",
  "settingEmphasis": [
    "ed",
    "icu",
    "or",
    "prehospital"
  ],
  "aliases": [
    "rapid sequence intubation",
    "7 Ps",
    "induction agent selection",
    "succinylcholine vs rocuronium",
    "LEMON",
    "post-intubation ventilator settings",
    "post-intubation hypotension"
  ],
  "tags": [
    "RSI",
    "intubation",
    "airway",
    "ketamine",
    "etomidate",
    "succinylcholine",
    "rocuronium",
    "LEMON",
    "post-intubation",
    "ED",
    "ICU",
    "OR"
  ],
  "keywords": [
    "preoxygenate 3 min",
    "ketamine 1.5-2 mg/kg",
    "etomidate 0.3 mg/kg",
    "succinylcholine 1.5 mg/kg",
    "rocuronium 1.2 mg/kg",
    "sugammadex 16 mg/kg",
    "ear-to-sternal-notch",
    "tube tip 3-5 cm above carina"
  ],
  "contentType": "reference",
  "content_version": 2,
  "last_reviewed": "2026-09-02",
  "next_review_due": "2026-12-02",
  "review_tier": 1,
  "sources": [
    "Critical Vector — EM Pocket Guide: RSI 7 P's + Post-Intubation Management",
    "ACEP airway guidance (2023); standard emergency airway management (Walls / Manual of Emergency Airway Management)"
  ],
  "changelog": [
    {
      "version": 2,
      "date": "2026-09-07",
      "change": "Added whyThisMatters + clinicalTakeaway (standard Reference Library template, DIRECTIONS_FORWARD §1)."
    },
    {
      "version": 1,
      "date": "2026-09-02",
      "change": "Initial entry — the 7 P's, induction-agent and NMB selection tables with doses, LEMON, CICO, and the post-intubation settings + hypotension checklist."
    }
  ],
  "summary": "Preparation · Preoxygenation · Pretreatment (optional) · Paralysis & induction · Positioning · Placement with confirmation · Post-intubation care. Push the induction agent and paralytic together (no fasciculation wait). Confirm with waveform capnography every time. For the physiologically fragile patient, see the physiologically-difficult-airway reference first.",
  "whyThisMatters": "RSI is the highest-risk routine procedure in acute care: the minutes around the tube are when hypoxia, hypotension, and a failed first attempt turn a stable patient into an arrest. A missed step in preparation or preoxygenation cannot be recovered once the paralytic is in.",
  "clinicalTakeaway": "Work the 7 P's in order, push the induction agent and paralytic together with no fasciculation wait, and confirm placement with waveform capnography every time. If the patient is physiologically fragile — hypoxemic, hypotensive, acidotic, or in RV failure — optimize that first (see the physiologically-difficult-airway reference) before you induce.",
  "body": [
    {
      "type": "heading",
      "level": 2,
      "text": "The 7 P's"
    },
    {
      "type": "list",
      "items": [
        "1. Preparation — monitoring, suction, BVM, laryngoscope + blade, ETT (7.5 F / 8.0 M) + stylet, EtCO2 detector, and a surgical airway kit at the bedside. Assign roles.",
        "2. Preoxygenation — NRB 15 L/min for 3 min, or HFNC 60 L/min, or CPAP/NIV 5 cmH2O; target SpO2 ≥ 96–99% before the attempt. Keep apneic oxygenation (nasal cannula 15 L/min) running through the attempt. Use NIV/BVM-with-PEEP, not a nonrebreather alone, if the SpO2 won't climb (PREOXI).",
        "3. Pretreatment (optional) — fentanyl 3 mcg/kg to blunt the sympathetic response (aortic dissection, raised ICP, ACS); lidocaine 1.5 mg/kg is of marginal benefit and often omitted.",
        "4. Paralysis & induction — give the induction agent and the NMB together (no wait for fasciculations).",
        "5. Positioning — ear-to-sternal-notch; ramp the obese patient; sniffing position; head of bed up.",
        "6. Placement with proof — direct or video laryngoscopy, tube through the cords, inflate the cuff, CONFIRM with waveform capnography (a sustained tracing over ≥ 6 breaths).",
        "7. Post-intubation — see below."
      ]
    },
    {
      "type": "heading",
      "level": 2,
      "text": "Induction agent"
    },
    {
      "type": "table",
      "columns": [
        "Agent",
        "Dose",
        "Hemodynamics",
        "Best for / avoid"
      ],
      "rows": [
        [
          "Ketamine",
          "1.5–2 mg/kg IV (reduce to 1 mg/kg in shock)",
          "Neutral to ↑ BP (indirect sympathomimetic; direct depressant unmasked in catecholamine-depleted shock)",
          "Shock, asthma, bronchospasm. Avoid uncontrolled hypertension / aortic dissection. RSI trial (2025): no safer than etomidate, more collapse — dose-reduce + pressor-ready"
        ],
        [
          "Etomidate",
          "0.3 mg/kg IV",
          "Neutral",
          "The most hemodynamically stable single agent. Single dose only — transient adrenal suppression (debated clinical significance in septic shock)"
        ],
        [
          "Propofol",
          "1.5–2 mg/kg IV (halve in the elderly / ASA III–IV)",
          "↓ BP 25–40%",
          "Status epilepticus, raised ICP, elective airways. Avoid in hypotension / hemodynamic fragility"
        ],
        [
          "Midazolam",
          "0.1–0.3 mg/kg IV",
          "↓ / neutral",
          "Variable depth, slower onset — rarely first choice for RSI"
        ]
      ]
    },
    {
      "type": "heading",
      "level": 2,
      "text": "Neuromuscular blocker"
    },
    {
      "type": "table",
      "columns": [
        "Agent",
        "Dose",
        "Onset",
        "Notes"
      ],
      "rows": [
        [
          "Succinylcholine",
          "1.5 mg/kg IV",
          "45–60 s",
          "Fastest; short duration. CONTRAINDICATED: burns / crush / denervation > 48–72 h old, pre-existing hyperkalemia, myopathy, prior malignant hyperthermia, pseudocholinesterase deficiency"
        ],
        [
          "Rocuronium",
          "1.2 mg/kg IV",
          "60–90 s",
          "Preferred when succinylcholine is contraindicated. Duration ~45–70 min — fully reversible with sugammadex 16 mg/kg for immediate rescue"
        ]
      ]
    },
    {
      "type": "heading",
      "level": 2,
      "text": "LEMON — difficult-airway prediction"
    },
    {
      "type": "list",
      "items": [
        "Look externally — obesity, beard, small mouth, facial trauma, large tongue.",
        "Evaluate 3-3-2 — mouth opening ≥ 3 fingers, hyoid-to-chin ≥ 3 fingers, thyroid-to-mouth-floor ≥ 2 fingers.",
        "Mallampati ≥ III.",
        "Obstruction / Obesity — stridor, abscess, epiglottitis, neck mass.",
        "Neck mobility reduced — c-collar, arthritis, halo."
      ]
    },
    {
      "type": "callout",
      "tone": "danger",
      "text": "CICO (cannot intubate, cannot oxygenate): declare it out loud and go to a surgical airway IMMEDIATELY — scalpel–finger–bougie–tube. Do NOT keep re-attempting laryngoscopy."
    },
    {
      "type": "heading",
      "level": 2,
      "text": "Post-intubation"
    },
    {
      "type": "table",
      "columns": [
        "Setting",
        "Initial"
      ],
      "rows": [
        [
          "Mode",
          "Volume assist-control (AC/VC)"
        ],
        [
          "Tidal volume",
          "6–8 mL/kg ideal body weight (6 if ARDS or at risk)"
        ],
        [
          "Rate",
          "12–16/min — adjust to match the pre-intubation minute ventilation and keep pH ≥ 7.35"
        ],
        [
          "FiO2",
          "1.0 initially → wean to SpO2 94–99%"
        ],
        [
          "PEEP",
          "5 cmH2O (raise per the ARDSNet ladder if ARDS)"
        ],
        [
          "I:E",
          "1:2 (1:3–4 for asthma / COPD to avoid air trapping)"
        ]
      ]
    },
    {
      "type": "list",
      "items": [
        "Confirm: waveform capnography (flat = esophageal or arrest), bilateral breath sounds + no epigastric sounds, CXR with the tube tip 3–5 cm above the carina. Secure the tube; document the cm mark at the lips.",
        "Sedation + analgesia: propofol 5–50 mcg/kg/min OR dexmedetomidine 0.2–1.5 mcg/kg/hr, plus a fentanyl infusion. Analgesia first, then titrate sedation to a light target (RASS 0 to −1).",
        "Post-intubation hypotension — reduce the PEEP, exclude a tension pneumothorax, treat hypovolemia (give fluid / push-dose pressor), and check for a right-main-bronchus intubation (pull the tube back)."
      ]
    }
  ],
  "related": [
    "airway-management-flow",
    "physiologically-difficult-airway",
    "awake-intubation",
    "capnography",
    "ventilator-management",
    "sedation-analgesia-agents"
  ],
  "buildNote": "Tier 1. The concrete drug/dose reference that airway-management-flow (workflow) and physiologically-difficult-airway (physiology) point to. Cross-links LEMON / Cormack-Lehane calculators."
}
